{"artifact_type":"date_level_pit_preflight_plan_v1","assets":["SPY","QQQ","AAPL","MSFT","NVDA","TSLA","AMZN","META"],"calendar":{"exchange":"XNYS","source":"exchange_calendars","timezone":"America/New_York"},"flags":{"NOT_AUTHORIZATION_FOR_ACQUISITION":true,"NO_PROVIDER_CALLS_EXECUTED":true},"schema_version":"1.0.0","semantic_hash_scope":"canonical-json-excluding-semantic_self_hash","semantic_self_hash":"sha256:b7f3df1af3731f5b7a4d55bfb1ffac4a66af5e468934916ef655c386379c1dea","sentinel_sessions":[{"calendar_metadata":{"calendar":"XNYS","close_utc":"2025-10-20T20:00:00+00:00","is_xnys_session":true,"open_utc":"2025-10-20T13:30:00+00:00","session_length_minutes":390,"session_type":"REGULAR","timezone":"America/New_York"},"date":"2025-10-20","scenario":"ANOMALY_UW"},{"calendar_metadata":{"calendar":"XNYS","close_utc":"2025-11-28T18:00:00+00:00","is_xnys_session":true,"open_utc":"2025-11-28T14:30:00+00:00","session_length_minutes":210,"session_type":"EARLY_CLOSE","timezone":"America/New_York"},"date":"2025-11-28","scenario":"EARLY_CLOSE"},{"calendar_metadata":{"calendar":"XNYS","close_utc":"2025-12-24T18:00:00+00:00","is_xnys_session":true,"open_utc":"2025-12-24T14:30:00+00:00","session_length_minutes":210,"session_type":"EARLY_CLOSE","timezone":"America/New_York"},"date":"2025-12-24","scenario":"EARLY_CLOSE"},{"calendar_metadata":{"calendar":"XNYS","close_utc":"2026-01-20T21:00:00+00:00","is_xnys_session":true,"open_utc":"2026-01-20T14:30:00+00:00","session_length_minutes":390,"session_type":"REGULAR","timezone":"America/New_York"},"date":"2026-01-20","scenario":"WINTER_REGULAR"},{"calendar_metadata":{"calendar":"XNYS","close_utc":"2026-03-06T21:00:00+00:00","is_xnys_session":true,"open_utc":"2026-03-06T14:30:00+00:00","session_length_minutes":390,"session_type":"REGULAR","timezone":"America/New_York"},"date":"2026-03-06","scenario":"PRE_DST"},{"calendar_metadata":{"calendar":"XNYS","close_utc":"2026-03-09T20:00:00+00:00","is_xnys_session":true,"open_utc":"2026-03-09T13:30:00+00:00","session_length_minutes":390,"session_type":"REGULAR","timezone":"America/New_York"},"date":"2026-03-09","scenario":"POST_DST"},{"calendar_metadata":{"calendar":"XNYS","close_utc":"2026-07-13T20:00:00+00:00","is_xnys_session":true,"open_utc":"2026-07-13T13:30:00+00:00","session_length_minutes":390,"session_type":"REGULAR","timezone":"America/New_York"},"date":"2026-07-13","scenario":"SUMMER_REGULAR"}],"status":"CANDIDATE_APPROVAL_REQUIRED"}
